{
  "event_id": "018f47df-7c09-7b1a-83b5-57f0d6e15f41",
  "type": "CandidateExpired",
  "schema_version": 1,
  "stream_session_id": "018f47df-7c09-7b1a-83b5-57f0d6e15f40",
  "turn_id": "018f47df-7c09-7b1a-83b5-57f0d6e15f42",
  "occurred_at": "2026-07-17T00:00:01.125000Z",
  "payload": {
    "candidate_id": "018f47df-7c09-7b1a-83b5-57f0d6e15f43"
  }
}
